{
  "schemaVersion": "1.0.0",
  "designId": {
    "value": "design-6549e683e252f6cb",
    "origin": "inferred",
    "confidence": "high",
    "note": "Deterministic binding identifier derived from the measured source SHA-256 fingerprint."
  },
  "designVersionId": {
    "value": "version-c1d204649370036e",
    "origin": "inferred",
    "confidence": "high",
    "note": "Deterministic identifier derived from the canonical extracted JSON, excluding mutable generatedAssets."
  },
  "assetBinding": {
    "directoryTemplate": {
      "value": "generated/{designId}/",
      "origin": "inferred",
      "confidence": "high",
      "note": "Generated assets are grouped in a directory named by the designId."
    },
    "filenameTemplate": {
      "value": "{designId}--{generationId}.png",
      "origin": "inferred",
      "confidence": "high",
      "note": "The PNG filename carries both the source design ID and the per-generation ID."
    },
    "pngMetadataKeys": {
      "value": ["designId", "designVersionId", "generationId", "sourceDesignPath"],
      "origin": "inferred",
      "confidence": "medium",
      "note": "The generator should embed these textual metadata keys when the PNG writer supports them."
    },
    "registrationRule": {
      "value": "Append one generatedAssets entry containing designVersionId, generationId and path after each successful PNG write.",
      "origin": "inferred",
      "confidence": "high",
      "note": "The JSON manifest is the reverse lookup from a design version to its generated files."
    }
  },
  "source": {
    "value": {
      "filename": "codex-clipboard-b8244a37-5614-4ef2-a61f-e2e54be366eb.png",
      "sha256": "6549e683e252f6cb4462499441768c01a198342bdd395b32b80b1cd1b9fc3adf",
      "designId": "design-6549e683e252f6cb",
      "format": "png"
    },
    "origin": "measured",
    "confidence": "high"
  },
  "canvas": {
    "widthPx": {
      "value": 2160,
      "origin": "measured",
      "confidence": "high"
    },
    "heightPx": {
      "value": 2160,
      "origin": "measured",
      "confidence": "high"
    },
    "aspectRatio": {
      "value": 1.0,
      "origin": "measured",
      "confidence": "high"
    }
  },
  "colors": [
    {
      "value": {
        "hex": "#1C1917",
        "coverage": 0.4056
      },
      "origin": "measured",
      "confidence": "high",
      "note": "Quantized dominant color from source pixels."
    },
    {
      "value": {
        "hex": "#402A20",
        "coverage": 0.1671
      },
      "origin": "measured",
      "confidence": "high",
      "note": "Quantized dominant color from source pixels."
    },
    {
      "value": {
        "hex": "#C5AA76",
        "coverage": 0.1592
      },
      "origin": "measured",
      "confidence": "high",
      "note": "Quantized dominant color from source pixels."
    },
    {
      "value": {
        "hex": "#E8E6E5",
        "coverage": 0.1285
      },
      "origin": "measured",
      "confidence": "high",
      "note": "Quantized dominant color from source pixels."
    },
    {
      "value": {
        "hex": "#6A5646",
        "coverage": 0.1139
      },
      "origin": "measured",
      "confidence": "high",
      "note": "Quantized dominant color from source pixels."
    },
    {
      "value": {
        "hex": "#1C1B1C",
        "coverage": 0.012
      },
      "origin": "measured",
      "confidence": "high",
      "note": "Quantized dominant color from source pixels."
    },
    {
      "value": {
        "hex": "#1C0E0B",
        "coverage": 0.0073
      },
      "origin": "measured",
      "confidence": "high",
      "note": "Quantized dominant color from source pixels."
    },
    {
      "value": {
        "hex": "#0F0706",
        "coverage": 0.0065
      },
      "origin": "measured",
      "confidence": "high",
      "note": "Quantized dominant color from source pixels."
    }
  ],
  "background": {
    "baseColor": {
      "value": "#1C1917",
      "origin": "measured",
      "confidence": "medium",
      "note": "Dominant color; background may contain additional layers."
    },
    "samples": {
      "value": [
        {
          "xPx": 0,
          "yPx": 0,
          "color": "#1C1917"
        },
        {
          "xPx": 2159,
          "yPx": 0,
          "color": "#1C1917"
        },
        {
          "xPx": 0,
          "yPx": 2159,
          "color": "#44403B"
        },
        {
          "xPx": 2159,
          "yPx": 2159,
          "color": "#44403B"
        },
        {
          "xPx": 1080,
          "yPx": 1080,
          "color": "#704836"
        }
      ],
      "origin": "measured",
      "confidence": "high"
    },
    "gradients": {
      "value": [],
      "origin": "inferred",
      "confidence": "low",
      "note": "Approximate gradient reading supplied by visual analysis; original stops and blend modes are unknown."
    }
  },
  "layout": {
    "margins": {
      "value": {
        "primaryTextLeft": 153,
        "topBannerTop": 120,
        "rightmostCardRight": 86,
        "bottomSurface": 0
      },
      "origin": "measured",
      "confidence": "medium",
      "note": "Measured from source element bounds."
    },
    "alignments": {
      "value": {
        "textColumn": "left-aligned at approximately x=153 px",
        "topBanner": "horizontally centered",
        "media": "overlapping card stack anchored to the lower surface"
      },
      "origin": "inferred",
      "confidence": "low",
      "note": "Alignment is a semantic interpretation of the visible composition."
    },
    "spacingPx": {
      "value": [
        107,
        76,
        6
      ],
      "origin": "measured",
      "confidence": "medium",
      "note": "Distances measured between visible element bounds."
    },
    "layerOrder": {
      "value": [
        "background",
        "lower-surface",
        "secondary-photo-accent",
        "secondary-photo",
        "primary-photo-accent",
        "primary-photo",
        "notification-badge",
        "notification-glyph",
        "brand-card",
        "brand-icon-badge",
        "brand-icon-glyph",
        "brand-wordmark",
        "brand-url",
        "top-banner",
        "top-banner-text",
        "primary-headline",
        "supporting-copy"
      ],
      "origin": "inferred",
      "confidence": "medium",
      "note": "Reconstructed from visible overlap and reading order."
    }
  },
  "typography": {
    "fontFamily": {
      "value": "unknown",
      "origin": "inferred",
      "confidence": "low",
      "note": "No font file or reliable font metadata is contained in the raster."
    },
    "fontCandidates": {
      "value": [],
      "origin": "inferred",
      "confidence": "low",
      "note": "No candidate is asserted without user-provided evidence."
    }
  },
  "images": [
    {
      "id": {
        "value": "secondary-photo",
        "origin": "inferred",
        "confidence": "medium",
        "note": "Visible bounds enclose the smaller portrait-oriented photograph and its dark rounded outline; the original photo asset and crop are unavailable."
      },
      "type": {
        "value": "image",
        "origin": "inferred",
        "confidence": "medium",
        "note": "Visible bounds enclose the smaller portrait-oriented photograph and its dark rounded outline; the original photo asset and crop are unavailable."
      },
      "role": {
        "value": "secondary-photographic-card",
        "origin": "inferred",
        "confidence": "medium",
        "note": "Visible bounds enclose the smaller portrait-oriented photograph and its dark rounded outline; the original photo asset and crop are unavailable."
      },
      "bounds": {
        "xPx": {
          "value": 160,
          "origin": "measured",
          "confidence": "medium",
          "note": "Measured against the source pixel grid after visual inspection."
        },
        "yPx": {
          "value": 1105,
          "origin": "measured",
          "confidence": "medium",
          "note": "Measured against the source pixel grid after visual inspection."
        },
        "widthPx": {
          "value": 650,
          "origin": "measured",
          "confidence": "medium",
          "note": "Measured against the source pixel grid after visual inspection."
        },
        "heightPx": {
          "value": 776,
          "origin": "measured",
          "confidence": "medium",
          "note": "Measured against the source pixel grid after visual inspection."
        },
        "x": {
          "value": 0.074074,
          "origin": "measured",
          "confidence": "medium",
          "note": "Measured against the source pixel grid after visual inspection."
        },
        "y": {
          "value": 0.511574,
          "origin": "measured",
          "confidence": "medium",
          "note": "Measured against the source pixel grid after visual inspection."
        },
        "width": {
          "value": 0.300926,
          "origin": "measured",
          "confidence": "medium",
          "note": "Measured against the source pixel grid after visual inspection."
        },
        "height": {
          "value": 0.359259,
          "origin": "measured",
          "confidence": "medium",
          "note": "Measured against the source pixel grid after visual inspection."
        }
      },
      "zIndex": {
        "value": 3,
        "origin": "inferred",
        "confidence": "medium",
        "note": "Layer order is reconstructed from visible overlap."
      },
      "confidence": {
        "value": "medium",
        "origin": "inferred",
        "confidence": "medium",
        "note": "Visible bounds enclose the smaller portrait-oriented photograph and its dark rounded outline; the original photo asset and crop are unavailable."
      },
      "image": {
        "value": {
          "content": "photograph of a person holding a handheld device and cup",
          "fit": "cover",
          "crop": "portrait",